<?xml version="1.0" encoding="UTF-8" standalone="no"?><list xmlns:xsi="http://www.w3.org/2001/XMLSchema-instance" xsi:noNamespaceSchemaLocation="../../../xsd/CharTemplates.xsd">
	<classtemplate classId="124" classLevel="1" name="Грешница" raceId="5" serverName="kamael_f_soldier">
		<lvlupvalues>
			<lvl_add cp="48.5" hp="97.0" lvl="1" mp="40.0"/>
			<lvl_add cp="56.69" hp="113.38" lvl="2" mp="47.28"/>
			<lvl_add cp="64.97" hp="129.94" lvl="3" mp="54.64"/>
			<lvl_add cp="73.34" hp="146.68" lvl="4" mp="62.08"/>
			<lvl_add cp="81.8" hp="163.6" lvl="5" mp="69.6"/>
			<lvl_add cp="90.35" hp="180.7" lvl="6" mp="77.2"/>
			<lvl_add cp="98.99" hp="197.98" lvl="7" mp="84.88"/>
			<lvl_add cp="107.72" hp="215.44" lvl="8" mp="92.64"/>
			<lvl_add cp="116.54" hp="233.08" lvl="9" mp="100.48"/>
			<lvl_add cp="125.45" hp="250.9" lvl="10" mp="108.4"/>
			<lvl_add cp="134.45" hp="268.9" lvl="11" mp="116.4"/>
			<lvl_add cp="143.54" hp="287.08" lvl="12" mp="124.48"/>
			<lvl_add cp="152.72" hp="305.44" lvl="13" mp="132.64"/>
			<lvl_add cp="161.99" hp="323.98" lvl="14" mp="140.88"/>
			<lvl_add cp="171.35" hp="342.7" lvl="15" mp="149.2"/>
			<lvl_add cp="180.8" hp="361.6" lvl="16" mp="157.6"/>
			<lvl_add cp="190.34" hp="380.68" lvl="17" mp="166.08"/>
			<lvl_add cp="199.97" hp="399.94" lvl="18" mp="174.64"/>
			<lvl_add cp="209.69" hp="419.38" lvl="19" mp="183.28"/>
			<lvl_add cp="219.5" hp="439.0" lvl="20" mp="192.0"/>
			<lvl_add cp="229.4" hp="458.8" lvl="21" mp="200.8"/>
			<lvl_add cp="239.39" hp="478.78" lvl="22" mp="209.68"/>
			<lvl_add cp="249.47" hp="498.94" lvl="23" mp="218.64"/>
			<lvl_add cp="259.64" hp="519.28" lvl="24" mp="227.68"/>
			<lvl_add cp="269.9" hp="539.8" lvl="25" mp="236.8"/>
			<lvl_add cp="280.25" hp="560.5" lvl="26" mp="246.0"/>
			<lvl_add cp="290.69" hp="581.38" lvl="27" mp="255.28"/>
			<lvl_add cp="301.22" hp="602.44" lvl="28" mp="264.64"/>
			<lvl_add cp="311.84" hp="623.68" lvl="29" mp="274.08"/>
			<lvl_add cp="322.55" hp="645.1" lvl="30" mp="283.6"/>
			<lvl_add cp="333.35" hp="666.7" lvl="31" mp="293.2"/>
			<lvl_add cp="344.24" hp="688.48" lvl="32" mp="302.88"/>
			<lvl_add cp="355.22" hp="710.44" lvl="33" mp="312.64"/>
			<lvl_add cp="366.29" hp="732.58" lvl="34" mp="322.48"/>
			<lvl_add cp="377.45" hp="754.9" lvl="35" mp="332.4"/>
			<lvl_add cp="388.7" hp="777.4" lvl="36" mp="342.4"/>
			<lvl_add cp="400.04" hp="800.08" lvl="37" mp="352.48"/>
			<lvl_add cp="411.47" hp="822.94" lvl="38" mp="362.64"/>
			<lvl_add cp="422.99" hp="845.98" lvl="39" mp="372.88"/>
			<lvl_add cp="434.6" hp="869.2" lvl="40" mp="383.2"/>
			<lvl_add cp="446.3" hp="892.6" lvl="41" mp="393.6"/>
			<lvl_add cp="458.09" hp="916.18" lvl="42" mp="404.08"/>
			<lvl_add cp="469.97" hp="939.94" lvl="43" mp="414.64"/>
			<lvl_add cp="481.94" hp="963.88" lvl="44" mp="425.28"/>
			<lvl_add cp="494.0" hp="988.0" lvl="45" mp="436.0"/>
			<lvl_add cp="506.15" hp="1012.3" lvl="46" mp="446.8"/>
			<lvl_add cp="518.39" hp="1036.78" lvl="47" mp="457.68"/>
			<lvl_add cp="530.72" hp="1061.44" lvl="48" mp="468.64"/>
			<lvl_add cp="543.14" hp="1086.28" lvl="49" mp="479.68"/>
			<lvl_add cp="555.65" hp="1111.3" lvl="50" mp="490.8"/>
			<lvl_add cp="568.25" hp="1136.5" lvl="51" mp="502.0"/>
			<lvl_add cp="580.94" hp="1161.88" lvl="52" mp="513.28"/>
			<lvl_add cp="593.72" hp="1187.44" lvl="53" mp="524.64"/>
			<lvl_add cp="606.59" hp="1213.18" lvl="54" mp="536.08"/>
			<lvl_add cp="619.55" hp="1239.1" lvl="55" mp="547.6"/>
			<lvl_add cp="632.6" hp="1265.2" lvl="56" mp="559.2"/>
			<lvl_add cp="645.74" hp="1291.48" lvl="57" mp="570.88"/>
			<lvl_add cp="658.97" hp="1317.94" lvl="58" mp="582.64"/>
			<lvl_add cp="672.29" hp="1344.58" lvl="59" mp="594.48"/>
			<lvl_add cp="685.7" hp="1371.4" lvl="60" mp="606.4"/>
			<lvl_add cp="699.2" hp="1398.4" lvl="61" mp="618.4"/>
			<lvl_add cp="712.79" hp="1425.58" lvl="62" mp="630.48"/>
			<lvl_add cp="726.47" hp="1452.94" lvl="63" mp="642.64"/>
			<lvl_add cp="740.24" hp="1480.48" lvl="64" mp="654.88"/>
			<lvl_add cp="754.1" hp="1508.2" lvl="65" mp="667.2"/>
			<lvl_add cp="768.05" hp="1536.1" lvl="66" mp="679.6"/>
			<lvl_add cp="782.09" hp="1564.18" lvl="67" mp="692.08"/>
			<lvl_add cp="796.22" hp="1592.44" lvl="68" mp="704.64"/>
			<lvl_add cp="810.44" hp="1620.88" lvl="69" mp="717.28"/>
			<lvl_add cp="824.75" hp="1649.5" lvl="70" mp="730.0"/>
			<lvl_add cp="839.15" hp="1678.3" lvl="71" mp="742.8"/>
			<lvl_add cp="853.64" hp="1707.28" lvl="72" mp="755.68"/>
			<lvl_add cp="868.22" hp="1736.44" lvl="73" mp="768.64"/>
			<lvl_add cp="882.89" hp="1765.78" lvl="74" mp="781.68"/>
			<lvl_add cp="897.65" hp="1795.3" lvl="75" mp="794.8"/>
			<lvl_add cp="912.5" hp="1825.0" lvl="76" mp="808.0"/>
			<lvl_add cp="927.44" hp="1854.88" lvl="77" mp="821.28"/>
			<lvl_add cp="942.47" hp="1884.94" lvl="78" mp="834.64"/>
			<lvl_add cp="957.59" hp="1915.18" lvl="79" mp="848.08"/>
			<lvl_add cp="972.8" hp="1945.6" lvl="80" mp="861.6"/>
			<lvl_add cp="988.1" hp="1976.2" lvl="81" mp="875.2"/>
			<lvl_add cp="1003.49" hp="2006.98" lvl="82" mp="888.88"/>
			<lvl_add cp="1018.97" hp="2037.94" lvl="83" mp="902.64"/>
			<lvl_add cp="1034.54" hp="2069.08" lvl="84" mp="916.48"/>
			<lvl_add cp="1050.2" hp="2100.4" lvl="85" mp="930.4"/>
			<lvl_add cp="1065.95" hp="2131.9" lvl="86" mp="944.4"/>
			<lvl_add cp="1081.79" hp="2163.58" lvl="87" mp="958.48"/>
			<lvl_add cp="1097.72" hp="2195.44" lvl="88" mp="972.64"/>
			<lvl_add cp="1113.74" hp="2227.48" lvl="89" mp="986.88"/>
			<lvl_add cp="1129.85" hp="2259.7" lvl="90" mp="1001.2"/>
			<lvl_add cp="1146.05" hp="2292.1" lvl="91" mp="1015.6"/>
			<lvl_add cp="1162.34" hp="2324.68" lvl="92" mp="1030.08"/>
			<lvl_add cp="1178.72" hp="2357.44" lvl="93" mp="1044.64"/>
			<lvl_add cp="1195.19" hp="2390.38" lvl="94" mp="1059.28"/>
			<lvl_add cp="1211.75" hp="2423.5" lvl="95" mp="1074.0"/>
			<lvl_add cp="1228.4" hp="2456.8" lvl="96" mp="1088.8"/>
			<lvl_add cp="1245.14" hp="2490.28" lvl="97" mp="1103.68"/>
			<lvl_add cp="1261.97" hp="2523.94" lvl="98" mp="1118.64"/>
			<lvl_add cp="1278.89" hp="2557.78" lvl="99" mp="1133.68"/>
		</lvlupvalues>
	</classtemplate>
</list>