<?xml version="1.0" encoding="UTF-8" standalone="no"?><list xmlns:xsi="http://www.w3.org/2001/XMLSchema-instance" xsi:noNamespaceSchemaLocation="../../../xsd/CharTemplates.xsd">
	<classtemplate classId="15" classLevel="20" name="Клерик" parentClassId="10" raceId="0" serverName="cleric">
		<lvlupvalues>
			<lvl_add cp="50.5" hp="101.0" lvl="1" mp="40.0"/>
			<lvl_add cp="58.235" hp="116.47" lvl="2" mp="47.28"/>
			<lvl_add cp="66.055" hp="132.11" lvl="3" mp="54.64"/>
			<lvl_add cp="73.96" hp="147.92" lvl="4" mp="62.08"/>
			<lvl_add cp="81.95" hp="163.9" lvl="5" mp="69.6"/>
			<lvl_add cp="90.025" hp="180.05" lvl="6" mp="77.2"/>
			<lvl_add cp="98.185" hp="196.37" lvl="7" mp="84.88"/>
			<lvl_add cp="106.43" hp="212.86" lvl="8" mp="92.64"/>
			<lvl_add cp="114.76" hp="229.52" lvl="9" mp="100.48"/>
			<lvl_add cp="123.175" hp="246.35" lvl="10" mp="108.4"/>
			<lvl_add cp="131.675" hp="263.35" lvl="11" mp="116.4"/>
			<lvl_add cp="140.26" hp="280.52" lvl="12" mp="124.48"/>
			<lvl_add cp="148.93" hp="297.86" lvl="13" mp="132.64"/>
			<lvl_add cp="157.685" hp="315.37" lvl="14" mp="140.88"/>
			<lvl_add cp="166.525" hp="333.05" lvl="15" mp="149.2"/>
			<lvl_add cp="175.45" hp="350.9" lvl="16" mp="157.6"/>
			<lvl_add cp="184.46" hp="368.92" lvl="17" mp="166.08"/>
			<lvl_add cp="193.555" hp="387.11" lvl="18" mp="174.64"/>
			<lvl_add cp="202.735" hp="405.47" lvl="19" mp="183.28"/>
			<lvl_add cp="212.0" hp="424.0" lvl="20" mp="192.0"/>
			<lvl_add cp="229.05" hp="458.1" lvl="21" mp="205.2"/>
			<lvl_add cp="246.255" hp="492.51" lvl="22" mp="218.52"/>
			<lvl_add cp="263.615" hp="527.23" lvl="23" mp="231.96"/>
			<lvl_add cp="281.13" hp="562.26" lvl="24" mp="245.52"/>
			<lvl_add cp="298.8" hp="597.6" lvl="25" mp="259.2"/>
			<lvl_add cp="316.625" hp="633.25" lvl="26" mp="273.0"/>
			<lvl_add cp="334.605" hp="669.21" lvl="27" mp="286.92"/>
			<lvl_add cp="352.74" hp="705.48" lvl="28" mp="300.96"/>
			<lvl_add cp="371.03" hp="742.06" lvl="29" mp="315.12"/>
			<lvl_add cp="389.475" hp="778.95" lvl="30" mp="329.4"/>
			<lvl_add cp="408.075" hp="816.15" lvl="31" mp="343.8"/>
			<lvl_add cp="426.83" hp="853.66" lvl="32" mp="358.32"/>
			<lvl_add cp="445.74" hp="891.48" lvl="33" mp="372.96"/>
			<lvl_add cp="464.805" hp="929.61" lvl="34" mp="387.72"/>
			<lvl_add cp="484.025" hp="968.05" lvl="35" mp="402.6"/>
			<lvl_add cp="503.4" hp="1006.8" lvl="36" mp="417.6"/>
			<lvl_add cp="522.93" hp="1045.86" lvl="37" mp="432.72"/>
			<lvl_add cp="542.615" hp="1085.23" lvl="38" mp="447.96"/>
			<lvl_add cp="562.455" hp="1124.91" lvl="39" mp="463.32"/>
			<lvl_add cp="582.45" hp="1164.9" lvl="40" mp="478.8"/>
			<lvl_add cp="602.6" hp="1205.2" lvl="41" mp="494.4"/>
			<lvl_add cp="622.905" hp="1245.81" lvl="42" mp="510.12"/>
			<lvl_add cp="643.365" hp="1286.73" lvl="43" mp="525.96"/>
			<lvl_add cp="663.98" hp="1327.96" lvl="44" mp="541.92"/>
			<lvl_add cp="684.75" hp="1369.5" lvl="45" mp="558.0"/>
			<lvl_add cp="705.675" hp="1411.35" lvl="46" mp="574.2"/>
			<lvl_add cp="726.755" hp="1453.51" lvl="47" mp="590.52"/>
			<lvl_add cp="747.99" hp="1495.98" lvl="48" mp="606.96"/>
			<lvl_add cp="769.38" hp="1538.76" lvl="49" mp="623.52"/>
			<lvl_add cp="790.925" hp="1581.85" lvl="50" mp="640.2"/>
			<lvl_add cp="812.625" hp="1625.25" lvl="51" mp="657.0"/>
			<lvl_add cp="834.48" hp="1668.96" lvl="52" mp="673.92"/>
			<lvl_add cp="856.49" hp="1712.98" lvl="53" mp="690.96"/>
			<lvl_add cp="878.655" hp="1757.31" lvl="54" mp="708.12"/>
			<lvl_add cp="900.975" hp="1801.95" lvl="55" mp="725.4"/>
			<lvl_add cp="923.45" hp="1846.9" lvl="56" mp="742.8"/>
			<lvl_add cp="946.08" hp="1892.16" lvl="57" mp="760.32"/>
			<lvl_add cp="968.865" hp="1937.73" lvl="58" mp="777.96"/>
			<lvl_add cp="991.805" hp="1983.61" lvl="59" mp="795.72"/>
			<lvl_add cp="1014.9" hp="2029.8" lvl="60" mp="813.6"/>
			<lvl_add cp="1038.15" hp="2076.3" lvl="61" mp="831.6"/>
			<lvl_add cp="1061.555" hp="2123.11" lvl="62" mp="849.72"/>
			<lvl_add cp="1085.115" hp="2170.23" lvl="63" mp="867.96"/>
			<lvl_add cp="1108.83" hp="2217.66" lvl="64" mp="886.32"/>
			<lvl_add cp="1132.7" hp="2265.4" lvl="65" mp="904.8"/>
			<lvl_add cp="1156.725" hp="2313.45" lvl="66" mp="923.4"/>
			<lvl_add cp="1180.905" hp="2361.81" lvl="67" mp="942.12"/>
			<lvl_add cp="1205.24" hp="2410.48" lvl="68" mp="960.96"/>
			<lvl_add cp="1229.73" hp="2459.46" lvl="69" mp="979.92"/>
			<lvl_add cp="1254.375" hp="2508.75" lvl="70" mp="999.0"/>
			<lvl_add cp="1279.175" hp="2558.35" lvl="71" mp="1018.2"/>
			<lvl_add cp="1304.13" hp="2608.26" lvl="72" mp="1037.52"/>
			<lvl_add cp="1329.24" hp="2658.48" lvl="73" mp="1056.96"/>
			<lvl_add cp="1354.505" hp="2709.01" lvl="74" mp="1076.52"/>
			<lvl_add cp="1379.925" hp="2759.85" lvl="75" mp="1096.2"/>
			<lvl_add cp="1405.5" hp="2811.0" lvl="76" mp="1116.0"/>
			<lvl_add cp="1431.23" hp="2862.46" lvl="77" mp="1135.92"/>
			<lvl_add cp="1457.115" hp="2914.23" lvl="78" mp="1155.96"/>
			<lvl_add cp="1483.155" hp="2966.31" lvl="79" mp="1176.12"/>
			<lvl_add cp="1509.35" hp="3018.7" lvl="80" mp="1196.4"/>
			<lvl_add cp="1535.7" hp="3071.4" lvl="81" mp="1216.8"/>
			<lvl_add cp="1562.205" hp="3124.41" lvl="82" mp="1237.32"/>
			<lvl_add cp="1588.865" hp="3177.73" lvl="83" mp="1257.96"/>
			<lvl_add cp="1615.68" hp="3231.36" lvl="84" mp="1278.72"/>
			<lvl_add cp="1642.65" hp="3285.3" lvl="85" mp="1299.6"/>
			<lvl_add cp="1669.775" hp="3339.55" lvl="86" mp="1320.6"/>
			<lvl_add cp="1697.055" hp="3394.11" lvl="87" mp="1341.72"/>
			<lvl_add cp="1724.49" hp="3448.98" lvl="88" mp="1362.96"/>
			<lvl_add cp="1752.08" hp="3504.16" lvl="89" mp="1384.32"/>
			<lvl_add cp="1779.825" hp="3559.65" lvl="90" mp="1405.8"/>
			<lvl_add cp="1807.725" hp="3615.45" lvl="91" mp="1427.4"/>
			<lvl_add cp="1835.78" hp="3671.56" lvl="92" mp="1449.12"/>
			<lvl_add cp="1863.99" hp="3727.98" lvl="93" mp="1470.96"/>
			<lvl_add cp="1892.355" hp="3784.71" lvl="94" mp="1492.92"/>
			<lvl_add cp="1920.875" hp="3841.75" lvl="95" mp="1515.0"/>
			<lvl_add cp="1949.55" hp="3899.1" lvl="96" mp="1537.2"/>
			<lvl_add cp="1978.38" hp="3956.76" lvl="97" mp="1559.52"/>
			<lvl_add cp="2007.365" hp="4014.73" lvl="98" mp="1581.96"/>
			<lvl_add cp="2036.505" hp="4073.01" lvl="99" mp="1604.52"/>
		</lvlupvalues>
	</classtemplate>
</list>