<?xml version="1.0" encoding="UTF-8" standalone="no"?><list xmlns:xsi="http://www.w3.org/2001/XMLSchema-instance" xsi:noNamespaceSchemaLocation="../../../xsd/CharTemplates.xsd">
	<classtemplate classId="173" classLevel="85" name="Заклинатель Иса" parentClassId="107" raceId="2" serverName="IssEnchanter_SpectralDancer">
		<lvlupvalues>
			<lvl_add cp="47.0" hp="94.0" lvl="1" mp="30.0"/>
			<lvl_add cp="53.825" hp="107.65" lvl="2" mp="35.46"/>
			<lvl_add cp="60.725" hp="121.45" lvl="3" mp="40.98"/>
			<lvl_add cp="67.7" hp="135.4" lvl="4" mp="46.56"/>
			<lvl_add cp="74.75" hp="149.5" lvl="5" mp="52.2"/>
			<lvl_add cp="81.875" hp="163.75" lvl="6" mp="57.9"/>
			<lvl_add cp="89.075" hp="178.15" lvl="7" mp="63.66"/>
			<lvl_add cp="96.35" hp="192.7" lvl="8" mp="69.48"/>
			<lvl_add cp="103.7" hp="207.4" lvl="9" mp="75.36"/>
			<lvl_add cp="111.125" hp="222.25" lvl="10" mp="81.3"/>
			<lvl_add cp="118.625" hp="237.25" lvl="11" mp="87.3"/>
			<lvl_add cp="126.2" hp="252.4" lvl="12" mp="93.36"/>
			<lvl_add cp="133.85" hp="267.7" lvl="13" mp="99.48"/>
			<lvl_add cp="141.575" hp="283.15" lvl="14" mp="105.66"/>
			<lvl_add cp="149.375" hp="298.75" lvl="15" mp="111.9"/>
			<lvl_add cp="157.25" hp="314.5" lvl="16" mp="118.2"/>
			<lvl_add cp="165.2" hp="330.4" lvl="17" mp="124.56"/>
			<lvl_add cp="173.225" hp="346.45" lvl="18" mp="130.98"/>
			<lvl_add cp="181.325" hp="362.65" lvl="19" mp="137.46"/>
			<lvl_add cp="189.5" hp="379.0" lvl="20" mp="144.0"/>
			<lvl_add cp="207.1" hp="414.2" lvl="21" mp="153.9"/>
			<lvl_add cp="224.86" hp="449.72" lvl="22" mp="163.89"/>
			<lvl_add cp="242.78" hp="485.56" lvl="23" mp="173.97"/>
			<lvl_add cp="260.86" hp="521.72" lvl="24" mp="184.14"/>
			<lvl_add cp="279.1" hp="558.2" lvl="25" mp="194.4"/>
			<lvl_add cp="297.5" hp="595.0" lvl="26" mp="204.75"/>
			<lvl_add cp="316.06" hp="632.12" lvl="27" mp="215.19"/>
			<lvl_add cp="334.78" hp="669.56" lvl="28" mp="225.72"/>
			<lvl_add cp="353.66" hp="707.32" lvl="29" mp="236.34"/>
			<lvl_add cp="372.7" hp="745.4" lvl="30" mp="247.05"/>
			<lvl_add cp="391.9" hp="783.8" lvl="31" mp="257.85"/>
			<lvl_add cp="411.26" hp="822.52" lvl="32" mp="268.74"/>
			<lvl_add cp="430.78" hp="861.56" lvl="33" mp="279.72"/>
			<lvl_add cp="450.46" hp="900.92" lvl="34" mp="290.79"/>
			<lvl_add cp="470.3" hp="940.6" lvl="35" mp="301.95"/>
			<lvl_add cp="490.3" hp="980.6" lvl="36" mp="313.2"/>
			<lvl_add cp="510.46" hp="1020.92" lvl="37" mp="324.54"/>
			<lvl_add cp="530.78" hp="1061.56" lvl="38" mp="335.97"/>
			<lvl_add cp="551.26" hp="1102.52" lvl="39" mp="347.49"/>
			<lvl_add cp="571.9" hp="1143.8" lvl="40" mp="359.1"/>
			<lvl_add cp="601.15" hp="1202.3" lvl="41" mp="378.6"/>
			<lvl_add cp="630.625" hp="1261.25" lvl="42" mp="398.25"/>
			<lvl_add cp="660.325" hp="1320.65" lvl="43" mp="418.05"/>
			<lvl_add cp="690.25" hp="1380.5" lvl="44" mp="438.0"/>
			<lvl_add cp="720.4" hp="1440.8" lvl="45" mp="458.1"/>
			<lvl_add cp="750.775" hp="1501.55" lvl="46" mp="478.35"/>
			<lvl_add cp="781.375" hp="1562.75" lvl="47" mp="498.75"/>
			<lvl_add cp="812.2" hp="1624.4" lvl="48" mp="519.3"/>
			<lvl_add cp="843.25" hp="1686.5" lvl="49" mp="540.0"/>
			<lvl_add cp="874.525" hp="1749.05" lvl="50" mp="560.85"/>
			<lvl_add cp="906.025" hp="1812.05" lvl="51" mp="581.85"/>
			<lvl_add cp="937.75" hp="1875.5" lvl="52" mp="603.0"/>
			<lvl_add cp="969.7" hp="1939.4" lvl="53" mp="624.3"/>
			<lvl_add cp="1001.875" hp="2003.75" lvl="54" mp="645.75"/>
			<lvl_add cp="1034.275" hp="2068.55" lvl="55" mp="667.35"/>
			<lvl_add cp="1066.9" hp="2133.8" lvl="56" mp="689.1"/>
			<lvl_add cp="1099.75" hp="2199.5" lvl="57" mp="711.0"/>
			<lvl_add cp="1132.825" hp="2265.65" lvl="58" mp="733.05"/>
			<lvl_add cp="1166.125" hp="2332.25" lvl="59" mp="755.25"/>
			<lvl_add cp="1199.65" hp="2399.3" lvl="60" mp="777.6"/>
			<lvl_add cp="1233.4" hp="2466.8" lvl="61" mp="800.1"/>
			<lvl_add cp="1267.375" hp="2534.75" lvl="62" mp="822.75"/>
			<lvl_add cp="1301.575" hp="2603.15" lvl="63" mp="845.55"/>
			<lvl_add cp="1336.0" hp="2672.0" lvl="64" mp="868.5"/>
			<lvl_add cp="1370.65" hp="2741.3" lvl="65" mp="891.6"/>
			<lvl_add cp="1405.525" hp="2811.05" lvl="66" mp="914.85"/>
			<lvl_add cp="1440.625" hp="2881.25" lvl="67" mp="938.25"/>
			<lvl_add cp="1475.95" hp="2951.9" lvl="68" mp="961.8"/>
			<lvl_add cp="1511.5" hp="3023.0" lvl="69" mp="985.5"/>
			<lvl_add cp="1547.275" hp="3094.55" lvl="70" mp="1009.35"/>
			<lvl_add cp="1583.275" hp="3166.55" lvl="71" mp="1033.35"/>
			<lvl_add cp="1619.5" hp="3239.0" lvl="72" mp="1057.5"/>
			<lvl_add cp="1655.95" hp="3311.9" lvl="73" mp="1081.8"/>
			<lvl_add cp="1692.625" hp="3385.25" lvl="74" mp="1106.25"/>
			<lvl_add cp="1729.525" hp="3459.05" lvl="75" mp="1130.85"/>
			<lvl_add cp="1766.65" hp="3533.3" lvl="76" mp="1155.6"/>
			<lvl_add cp="1804.0" hp="3608.0" lvl="77" mp="1180.5"/>
			<lvl_add cp="1841.575" hp="3683.15" lvl="78" mp="1205.55"/>
			<lvl_add cp="1879.375" hp="3758.75" lvl="79" mp="1230.75"/>
			<lvl_add cp="1917.4" hp="3834.8" lvl="80" mp="1256.1"/>
			<lvl_add cp="1955.65" hp="3911.3" lvl="81" mp="1281.6"/>
			<lvl_add cp="1994.125" hp="3988.25" lvl="82" mp="1307.25"/>
			<lvl_add cp="2032.825" hp="4065.65" lvl="83" mp="1333.05"/>
			<lvl_add cp="2071.75" hp="4143.5" lvl="84" mp="1359.0"/>
			<lvl_add cp="5050.99" hp="4401.8" lvl="85" mp="1846.8"/>
			<lvl_add cp="5100.51" hp="4444.95" lvl="86" mp="1881.8"/>
			<lvl_add cp="5150.52" hp="4488.53" lvl="87" mp="1917.0"/>
			<lvl_add cp="5201.01" hp="4532.53" lvl="88" mp="1952.4"/>
			<lvl_add cp="5252.0" hp="4576.97" lvl="89" mp="1988.0"/>
			<lvl_add cp="5303.49" hp="4621.84" lvl="90" mp="2023.8"/>
			<lvl_add cp="5355.49" hp="4667.16" lvl="91" mp="2059.8"/>
			<lvl_add cp="5407.99" hp="4712.91" lvl="92" mp="2096.0"/>
			<lvl_add cp="5461.01" hp="4759.12" lvl="93" mp="2132.4"/>
			<lvl_add cp="5514.55" hp="4805.77" lvl="94" mp="2169.0"/>
			<lvl_add cp="5568.61" hp="4852.89" lvl="95" mp="2205.8"/>
			<lvl_add cp="5623.21" hp="4900.47" lvl="96" mp="2242.8"/>
			<lvl_add cp="5678.34" hp="4948.51" lvl="97" mp="2280.0"/>
			<lvl_add cp="5734.01" hp="4997.03" lvl="98" mp="2317.4"/>
			<lvl_add cp="5790.22" hp="5046.02" lvl="99" mp="2355.0"/>
		</lvlupvalues>
	</classtemplate>
</list>