<?xml version="1.0" encoding="UTF-8" standalone="no"?><list xmlns:xsi="http://www.w3.org/2001/XMLSchema-instance" xsi:noNamespaceSchemaLocation="../../../xsd/CharTemplates.xsd">
	<classtemplate classId="38" classLevel="1" name="Тёмный Мистик" raceId="2" serverName="dark_mage">
		<lvlupvalues>
			<lvl_add cp="53.0" hp="106.0" lvl="1" mp="40.0"/>
			<lvl_add cp="60.735" hp="121.47" lvl="2" mp="47.28"/>
			<lvl_add cp="68.555" hp="137.11" lvl="3" mp="54.64"/>
			<lvl_add cp="76.46" hp="152.92" lvl="4" mp="62.08"/>
			<lvl_add cp="84.45" hp="168.9" lvl="5" mp="69.6"/>
			<lvl_add cp="92.525" hp="185.05" lvl="6" mp="77.2"/>
			<lvl_add cp="100.685" hp="201.37" lvl="7" mp="84.88"/>
			<lvl_add cp="108.93" hp="217.86" lvl="8" mp="92.64"/>
			<lvl_add cp="117.26" hp="234.52" lvl="9" mp="100.48"/>
			<lvl_add cp="125.675" hp="251.35" lvl="10" mp="108.4"/>
			<lvl_add cp="134.175" hp="268.35" lvl="11" mp="116.4"/>
			<lvl_add cp="142.76" hp="285.52" lvl="12" mp="124.48"/>
			<lvl_add cp="151.43" hp="302.86" lvl="13" mp="132.64"/>
			<lvl_add cp="160.185" hp="320.37" lvl="14" mp="140.88"/>
			<lvl_add cp="169.025" hp="338.05" lvl="15" mp="149.2"/>
			<lvl_add cp="177.95" hp="355.9" lvl="16" mp="157.6"/>
			<lvl_add cp="186.96" hp="373.92" lvl="17" mp="166.08"/>
			<lvl_add cp="196.055" hp="392.11" lvl="18" mp="174.64"/>
			<lvl_add cp="205.235" hp="410.47" lvl="19" mp="183.28"/>
			<lvl_add cp="214.5" hp="429.0" lvl="20" mp="192.0"/>
			<lvl_add cp="223.85" hp="447.7" lvl="21" mp="200.8"/>
			<lvl_add cp="233.285" hp="466.57" lvl="22" mp="209.68"/>
			<lvl_add cp="242.805" hp="485.61" lvl="23" mp="218.64"/>
			<lvl_add cp="252.41" hp="504.82" lvl="24" mp="227.68"/>
			<lvl_add cp="262.1" hp="524.2" lvl="25" mp="236.8"/>
			<lvl_add cp="271.875" hp="543.75" lvl="26" mp="246.0"/>
			<lvl_add cp="281.735" hp="563.47" lvl="27" mp="255.28"/>
			<lvl_add cp="291.68" hp="583.36" lvl="28" mp="264.64"/>
			<lvl_add cp="301.71" hp="603.42" lvl="29" mp="274.08"/>
			<lvl_add cp="311.825" hp="623.65" lvl="30" mp="283.6"/>
			<lvl_add cp="322.025" hp="644.05" lvl="31" mp="293.2"/>
			<lvl_add cp="332.31" hp="664.62" lvl="32" mp="302.88"/>
			<lvl_add cp="342.68" hp="685.36" lvl="33" mp="312.64"/>
			<lvl_add cp="353.135" hp="706.27" lvl="34" mp="322.48"/>
			<lvl_add cp="363.675" hp="727.35" lvl="35" mp="332.4"/>
			<lvl_add cp="374.3" hp="748.6" lvl="36" mp="342.4"/>
			<lvl_add cp="385.01" hp="770.02" lvl="37" mp="352.48"/>
			<lvl_add cp="395.805" hp="791.61" lvl="38" mp="362.64"/>
			<lvl_add cp="406.685" hp="813.37" lvl="39" mp="372.88"/>
			<lvl_add cp="417.65" hp="835.3" lvl="40" mp="383.2"/>
			<lvl_add cp="428.7" hp="857.4" lvl="41" mp="393.6"/>
			<lvl_add cp="439.835" hp="879.67" lvl="42" mp="404.08"/>
			<lvl_add cp="451.055" hp="902.11" lvl="43" mp="414.64"/>
			<lvl_add cp="462.36" hp="924.72" lvl="44" mp="425.28"/>
			<lvl_add cp="473.75" hp="947.5" lvl="45" mp="436.0"/>
			<lvl_add cp="485.225" hp="970.45" lvl="46" mp="446.8"/>
			<lvl_add cp="496.785" hp="993.57" lvl="47" mp="457.68"/>
			<lvl_add cp="508.43" hp="1016.86" lvl="48" mp="468.64"/>
			<lvl_add cp="520.16" hp="1040.32" lvl="49" mp="479.68"/>
			<lvl_add cp="531.975" hp="1063.95" lvl="50" mp="490.8"/>
			<lvl_add cp="543.875" hp="1087.75" lvl="51" mp="502.0"/>
			<lvl_add cp="555.86" hp="1111.72" lvl="52" mp="513.28"/>
			<lvl_add cp="567.93" hp="1135.86" lvl="53" mp="524.64"/>
			<lvl_add cp="580.085" hp="1160.17" lvl="54" mp="536.08"/>
			<lvl_add cp="592.325" hp="1184.65" lvl="55" mp="547.6"/>
			<lvl_add cp="604.65" hp="1209.3" lvl="56" mp="559.2"/>
			<lvl_add cp="617.06" hp="1234.12" lvl="57" mp="570.88"/>
			<lvl_add cp="629.555" hp="1259.11" lvl="58" mp="582.64"/>
			<lvl_add cp="642.135" hp="1284.27" lvl="59" mp="594.48"/>
			<lvl_add cp="654.8" hp="1309.6" lvl="60" mp="606.4"/>
			<lvl_add cp="667.55" hp="1335.1" lvl="61" mp="618.4"/>
			<lvl_add cp="680.385" hp="1360.77" lvl="62" mp="630.48"/>
			<lvl_add cp="693.305" hp="1386.61" lvl="63" mp="642.64"/>
			<lvl_add cp="706.31" hp="1412.62" lvl="64" mp="654.88"/>
			<lvl_add cp="719.4" hp="1438.8" lvl="65" mp="667.2"/>
			<lvl_add cp="732.575" hp="1465.15" lvl="66" mp="679.6"/>
			<lvl_add cp="745.835" hp="1491.67" lvl="67" mp="692.08"/>
			<lvl_add cp="759.18" hp="1518.36" lvl="68" mp="704.64"/>
			<lvl_add cp="772.61" hp="1545.22" lvl="69" mp="717.28"/>
			<lvl_add cp="786.125" hp="1572.25" lvl="70" mp="730.0"/>
			<lvl_add cp="799.725" hp="1599.45" lvl="71" mp="742.8"/>
			<lvl_add cp="813.41" hp="1626.82" lvl="72" mp="755.68"/>
			<lvl_add cp="827.18" hp="1654.36" lvl="73" mp="768.64"/>
			<lvl_add cp="841.035" hp="1682.07" lvl="74" mp="781.68"/>
			<lvl_add cp="854.975" hp="1709.95" lvl="75" mp="794.8"/>
			<lvl_add cp="869.0" hp="1738.0" lvl="76" mp="808.0"/>
			<lvl_add cp="883.11" hp="1766.22" lvl="77" mp="821.28"/>
			<lvl_add cp="897.305" hp="1794.61" lvl="78" mp="834.64"/>
			<lvl_add cp="911.585" hp="1823.17" lvl="79" mp="848.08"/>
			<lvl_add cp="925.95" hp="1851.9" lvl="80" mp="861.6"/>
			<lvl_add cp="940.4" hp="1880.8" lvl="81" mp="875.2"/>
			<lvl_add cp="954.935" hp="1909.87" lvl="82" mp="888.88"/>
			<lvl_add cp="969.555" hp="1939.11" lvl="83" mp="902.64"/>
			<lvl_add cp="984.26" hp="1968.52" lvl="84" mp="916.48"/>
			<lvl_add cp="999.05" hp="1998.1" lvl="85" mp="930.4"/>
			<lvl_add cp="1013.925" hp="2027.85" lvl="86" mp="944.4"/>
			<lvl_add cp="1028.885" hp="2057.77" lvl="87" mp="958.48"/>
			<lvl_add cp="1043.93" hp="2087.86" lvl="88" mp="972.64"/>
			<lvl_add cp="1059.06" hp="2118.12" lvl="89" mp="986.88"/>
			<lvl_add cp="1074.275" hp="2148.55" lvl="90" mp="1001.2"/>
			<lvl_add cp="1089.575" hp="2179.15" lvl="91" mp="1015.6"/>
			<lvl_add cp="1104.96" hp="2209.92" lvl="92" mp="1030.08"/>
			<lvl_add cp="1120.43" hp="2240.86" lvl="93" mp="1044.64"/>
			<lvl_add cp="1135.985" hp="2271.97" lvl="94" mp="1059.28"/>
			<lvl_add cp="1151.625" hp="2303.25" lvl="95" mp="1074.0"/>
			<lvl_add cp="1167.35" hp="2334.7" lvl="96" mp="1088.8"/>
			<lvl_add cp="1183.16" hp="2366.32" lvl="97" mp="1103.68"/>
			<lvl_add cp="1199.055" hp="2398.11" lvl="98" mp="1118.64"/>
			<lvl_add cp="1215.035" hp="2430.07" lvl="99" mp="1133.68"/>
		</lvlupvalues>
	</classtemplate>
</list>